,_id,email,situacao-habitacional,distrito,concelho,freguesia,area-util,tipo-casa,tipologia,ano-nascimento,nacionalidade,rendimento-anual,num-pessoas-nao-dependentes,num-pessoas-dependentes,situacao-profissional,educacao,satisfacao,testemunho,comentarios,percentagem-renda-paga,valor-mensal-renda,ano-inicio-arrendamento,rendimento-arrendamento,estrategia-arrendamento,insatisfacao-motivos,insertedAt,valor-compra,ano-compra,estado-conservacao,estrategia-compra,rendimento-liquido-anual-individual-na-compra,outra-insatisfacao,rendimento-liquido-anual-conjunto-na-compra,outra-estrategia-arrendamento,ano-heranca-aquisicao,rendimento-liquido-anual-individual-na-aquisicao,rendimento-heranca-conjunto,estado-conservacao-heranca,hashingV2,salt,outra-estrategia-compra
246,6644be3aba054319e6cde6a3,3806a40022bd41c2d670d18bfa3af8870fc5640174c4356b144f6d35b3b91657,['outrem'],lisboa,lisboa,lumiar,41-60,['apartamento'],['T3'],1986,bangladexe,sem-rendimento,0,1,['outro'],mestrado,['muito-insatisfeito'],"Very challenging situation, uncertain, expensive",Looking for convenient housing ,,,,,,"['pago-demasiado', 'dificuldades-financeiras', 'financeiramente-dependente', 'partilho-casa-com-desconhecidos']",2024-05-15 13:52:58.886,,,,,,,,,,,,,True,fa6dc84e5c6b22cdbd8e19e74b8cb0be,
247,6644be67ba054319e6cde6a5,90d31c3e95e3fc1e94c550ba75c8d16dba7526d0571646ae399448de970ef890,['comprei'],lisboa,amadora,falagueira-venda nova,61-80,['apartamento'],['T3'],1975,portugal,20001-35000,1,2,['empregado-tempo-inteiro'],licenciatura,['satisfeito'],NR,NR,,,,,,"['pago-demasiado', 'falta-espaco']",2024-05-15 13:53:43.707,195000.0,2022.0,recem-construido,['emprestimo'],20001-35000,,,,,,,,True,fb493c4d651ed08e3abc92a55dec9bcd,
248,6644c13bba054319e6cde6a7,af7010928d6e93c5245a7aebd7a4f1ed1f5931cacd369c0d464d138ec95e4f1d,['comprei'],setúbal,palmela,quinta do anjo,101-200,['apartamento'],['T3'],1981,portugal,35001-50000,1,0,['empregado-tempo-inteiro'],licenciatura,['satisfeito'],NR,NR,,,,,,['outro'],2024-05-15 14:05:47.297,160.0,2009.0,raiz,['emprestimo'],20001-35000,longe da familia,,,,,,,True,5b062e90e7ba78e9846f3461f9adb656,
249,6644cbc13ccee754d256fa0d,fe47bd1c838de8c4eb31ce27e782c1daafec319e425b3f5cec623bd20061c0de,['comprei'],lisboa,vila franca de xira,união das freguesias de póvoa de santa iria e forte da casa,101-200,['apartamento'],['T4+'],1973,portugal,12001-20000,1,0,['empregado-tempo-inteiro'],licenciatura,['muito-satisfeito'],NR,NR,,,,,,,2024-05-15 14:50:41.533,212500.0,2007.0,raiz,"['emprestimo', 'outra']",7001-12000,,,,,,,,True,302c8e5abde3c27a4d8423d8febdb857,Parte em capitais próprios
250,6644d118a4f021dcc2ffafe8,9b0f54050693373b2f4760c19d9a54ef6209965cf7c116c05605b692d4c74ad9,['outrem'],lisboa,loures,"união das freguesias de camarate, unhos e apelação",61-80,['apartamento'],['T3'],1984,portugal,12001-20000,2,0,['independente'],doutoramento,['muito-insatisfeito'],NR,NR,,,,,,['quero-independecia'],2024-05-15 15:13:28.753,,,,,,,,,,,,,True,1d60f3c00ac0fa8944c2a033df449318,
251,6644e8e6bddceec4ad0b5ec3,4c86657cb779badef27093cfa18b26b0003f8e17fdafcf517d32b411d73532fd,['outrem'],setúbal,setúbal,setúbal (são sebastião),101-200,['moradia'],['T4+'],1996,portugal,20001-35000,2,0,['empregado-tempo-inteiro'],mestrado,['muito-satisfeito'],NR,NR,,,,,,,2024-05-15 16:55:02.750,,,,,,,,,,,,,True,0b213d0334e0c27da748d4e1d119204f,
252,6644eb0d1ad0d98bbdf3115b,ddd8b0c6d780167b46145ee8f43baaf4c087d5a024fa1452ca8263836dea5eee,['outrem'],faro,loulé,quarteira,41-60,['moradia'],['T2'],1989,italia,35001-50000,0,2,['independente'],licenciatura,['muito-insatisfeito'],I find housing here in the Algarve is unaffordable. Mainly due to the large taxes placed on a property purchase. I earn a very good salary and am still unable to afford a home as i cannot afford rent and save for a deposit with taxes too. I do t understand how anyone under 35 affords a home in Portugal especially with the low wages. Its very sad and I hope the situation improves so young first time buyers like myself can afford a home and raise a family,NR,,,,,,['quero-independecia'],2024-05-15 17:04:13.201,,,,,,,,,,,,,True,5a192a37850cf83e10b061e9c7c05687,
253,6644f37edf80ab4ec0a8e795,b5348ce75b24bde1bc16c938adfe32461b58bfaaa880d30462a54cf133fc89de,['comprei'],porto,maia,nogueira e silva escura,101-200,['apartamento'],['T3'],1997,portugal,20001-35000,0,0,['empregado-tempo-inteiro'],mestrado,['indiferente'],NR,NR,,,,,,"['vivo-longe', 'pago-demasiado']",2024-05-15 17:40:14.809,230000.0,2024.0,bom,['emprestimo'],35001-50000,,,,,,,,True,8e20df2a22e28714667a6ebdd5d6d4de,
254,6644fd9cf036f32873331029,e21064cc5dae3085416de2b4b2c3daa91f6ea695380508e61e385814460ba438,['arrendo'],viseu,são pedro do sul,"união das freguesias de são pedro do sul, várzea e baiões",21-40,['apartamento'],['T0'],1994,india,7001-12000,0,0,['empregado-tempo-inteiro'],NA,['indiferente'],NR,NR,100,252.0,2022.0,7001-12000,['sem-ajuda'],"['falta-espaco', 'pago-demasiado']",2024-05-15 18:23:24.146,,,,,,,,,,,,,True,08172908fabaeda2ae8d303e4132e786,
255,66450a58aab60c663f206de3,7f19ff1b4114ebf6c43a7f762a33f0b6b54358a8b6a2bdb1f69d66c6e65b6e41,['arrendo'],lisboa,sintra,união das freguesias de massamá e monte abraão,81-100,['apartamento'],['T2'],1991,portugal,12001-20000,1,0,['empregado-tempo-inteiro'],mestrado,['insatisfeito'],"Não consigo comprar habitação própria, por isso estou a arrendar um apartamento. Sinto-me numa posição fragilizada se a minha senhoria me continuar a subir a renda e/ou tiver que procurar outro sítio pra viver devido aos elevados preços das rendas praticadas.",NR,100,850.0,2020.0,7001-12000,['sem-ajuda'],"['pago-demasiado', 'dificuldades-financeiras']",2024-05-15 19:17:44.734,,,,,,,,,,,,,True,527075637fd034114913857613175fd6,
256,66451ac082abe3ecd2456060,7e1b9f743a22a7d9a7d12c3f4767a5f7a28015e1ac645dfbcc02c9136a384af9,['arrendo'],coimbra,coimbra,"união das freguesias de coimbra (sé nova, santa cruz, almedina e são bartolomeu)",<20,['apartamento'],['T0'],1985,salvador,7001-12000,1,0,['empregado-tempo-inteiro'],mestrado,['muito-insatisfeito'],NR,NR,100,480.0,2023.0,7001-12000,['sem-ajuda'],"['falta-espaco', 'pago-demasiado']",2024-05-15 20:27:44.847,,,,,,,,,,,,,True,56d7cf263f0b950ea655b6756f04432f,
257,664526f60f105d341c9b0412,ce4f18327eef5e1735a413ac3d1c648e98a6effa852a9a82d0907adefeb25f45,['arrendo'],lisboa,cascais,união das freguesias de cascais e estoril,81-100,['apartamento'],['T3'],1983,russia,>80001,0,2,['independente'],mestrado,['indiferente'],NR,NR,100,2000.0,2022.0,>80001,['sem-ajuda'],"['outro', 'pago-demasiado']",2024-05-15 21:19:50.902,,,,,,Muito caro,,,,,,,True,82a24a379348ffa12ae70c9443e558c6,
258,66454236c3556c461333cb2f,5a58ba95f7e282bf10bc3baab0d141986e17388ee53f2e67e0c9edde100d624c,['outrem'],porto,vila nova de gaia,união das freguesias de gulpilhares e valadares,<20,['moradia'],['T1'],1970,portugal,<7001,4,4,['desempregada'],basico,['muito-insatisfeito'],Estou a viver na casa da minha sogra pois onde vivíamos era em um apartamento t.2 na qual tivemos ordem de despejo pois o senhorio quis vender vivo nestas condições desde janeiro deste ano mas tive ordem de despejo em 2021 estou inscrita na gaiurb desde 2005 tenho uma menina especial com 82 por cento de incapacidade e até hoje a resposta que dão é que não á casas terei que sair daqui antes que a senhoria da minha sogra descubra pois estamos a pôr em risco a vida de uma pessoa com 80 anos de ir também para a rua estou revoltada com o nosso país pois nada fazem e a nossa solução é ir viver na rua com uma menina especial na qual desde que ficámos sem casa a sua saúde tem piorado não sei mais o que fazer como mãe estou desesperada 😢,Sou uma mãe revoltada e desesperada sem soluções para o nosso problema e neste momento só penso na minha menina o que vai ser de nós a viver na rua ,,,,,,['outro'],2024-05-15 23:16:06.353,,,,,,A casa não é minha estou a viver às escondidas da senhoria na qual estou a por em risco uma idosa a casa não tem condições para viver tanta gente e com uma menina especial que tem um grau de incapacidade de 82 por cento não sei o que fazer vou viver na rua ,,,,,,,True,efc155119a4ad52ae7632ac04c530f79,
259,664596aafb7ac096b4c2c540,c84dd2cdaeb6b89b81611d293c83c7a8bc33727d751f93bd7facefd1608fec59,['arrendo'],setúbal,almada,"união das freguesias de almada, cova da piedade, pragal e cacilhas",61-80,['apartamento'],['T2'],1995,franca,20001-35000,2,0,['contrato-temporario'],mestrado,['insatisfeito'],transport,Há tantos edifícios para partir. Vazios. Os jovens deviam ser autorizados a reconstruí-los. E não grandes cabrões com empresas de construção XXL.,100,1100.0,2023.0,20001-35000,"['apoio-familiar-inicio', 'outra']","['vivo-longe', 'pago-demasiado', 'dificuldades-financeiras']",2024-05-16 05:16:26.812,,,,,,,,Aceitei outro emprego. Dois empregos para viver 🥲😔,,,,,True,1cec13a1701b48457af6c15a7e7f139f,
260,6645a6c07e1e0a5511f39843,f6b56fb141b955abce287cb7d8527cb7b45cc7a08dfdbeddce06c1b0c2bf519b,['outrem'],ilha da madeira,machico,machico,201-400,['moradia'],['T4+'],1996,portugal,20001-35000,3,0,['empregado-tempo-inteiro'],mestrado,['indiferente'],NR,NR,,,,,,['quero-independecia'],2024-05-16 06:25:04.488,,,,,,,,,,,,,True,4dd25d5e2cb63f99cb292f0d330192ff,
261,6645af162924cc9733cb1196,a7636965109f1d38fcfa32692b088e07e41fb4033332991a5936ae29e50bcf7d,['outrem'],aveiro,arouca,escariz,201-400,['moradia'],['T3'],1996,portugal,35001-50000,3,0,"['empregado-tempo-inteiro', 'independente']",secundario,['satisfeito'],NR,NR,,,,,,"['vivo-longe', 'vivo-longe-de-transportes', 'financeiramente-dependente', 'quero-independecia']",2024-05-16 07:00:38.277,,,,,,,,,,,,,True,5ec36fa13c2991639666d8d4e1576cb7,
262,6645b297f55bf4924155b84c,2cd461e1ab3b97178e4ef7cfefc56a9c718c1f4de3cf8ae8bb3265de99444244,['comprei'],porto,porto,paranhos,101-200,['moradia'],['T3'],1985,irlanda,50001-80000,3,1,['empregado-tempo-inteiro'],mestrado,['satisfeito'],NR,NR,,,,,,['pago-demasiado'],2024-05-16 07:15:35.516,209000.0,2018.0,medio,['emprestimo'],35001-50000,,,,,,,,True,a005a9498d8f440afbbcf03fd3358772,
263,6645cee048223c02ce4a1ec6,a7847f7c145c80a7e3f835b6d061408da534b27b807928b517c617c80ecda398,['outrem'],lisboa,lisboa,são vicente,81-100,['apartamento'],['T3'],2000,portugal,12001-20000,3,0,['empregado-tempo-inteiro'],licenciatura,['insatisfeito'],"Alugava quarto antes mas subiram a renda ao ponto de não conseguir pagar, era mais de metade do meu ordenado na altura",NR,,,,,,['outro'],2024-05-16 09:16:16.775,,,,,,Fico em casa de familiares porque não consigo alugar casa,,,,,,,True,6f6b2e1db222d67620709fb9e41b0de2,
264,6645e592bc0caa0198893107,03e008ccd90f9f5f2df4db748737fc8e76150b15725d5501f5ad5cfc8c417799,['arrendo'],porto,porto,"união das freguesias de cedofeita, santo ildefonso, sé, miragaia, são nicolau e vitória",21-40,['apartamento'],['T1'],1991,russia,35001-50000,1,0,['empregado-tempo-inteiro'],licenciatura,['muito-insatisfeito'],"Tentando comprar um apartamento a crédito, mas os preços são muito altos e as condições de crédito são cabálicas",NR,50,750.0,2020.0,20001-35000,['sem-ajuda'],"['falta-espaco', 'habitacao-mau-estado']",2024-05-16 10:53:06.258,,,,,,,,,,,,,True,0eb2f5f1015fda13ea7f72f8187b2ac4,
265,6645f242562d85d101d9da68,e7f374445495236be7ce9888f1d7fe50276908a04ad464aa59e6537f84314b43,['arrendo'],aveiro,aveiro,esgueira,21-40,['apartamento'],['T1'],1986,brasil,7001-12000,2,0,"['empregado-tempo-inteiro', 'estudante-tempo-integral']",doutoramento,['indiferente'],NR,NR,50,300.0,2014.0,<7001,['apoio-familiar-inicio'],['falta-espaco'],2024-05-16 11:47:14.548,,,,,,,,,,,,,True,155b8b4bc04a0741b86e0557647596ba,
266,6645fd25b579c6318b63c3a1,bb13cd60dcb2d437de6ca1546db5f77ba3fdf8b2e0cf3a5e67f937e1f659e497,['comprei'],porto,vila nova de gaia,união das freguesias de gulpilhares e valadares,201-400,['moradia'],['T4+'],1982,portugal,20001-35000,1,2,['empregado-tempo-inteiro'],mestrado,['muito-satisfeito'],Antes estávamos a arrendar com apoio do estado para jovens. Já amortizamos tudo.,NR,,,,,,,2024-05-16 12:33:41.444,225000.0,2010.0,raiz,"['emprestimo', 'sem-ajuda', 'conjunto']",20001-35000,,35001-50000,,,,,,True,7e8bbd5103d855630e7d828761c31189,
267,664616baabb8d4ff15b99f2f,0d6c8b6c862462bfd8ad8c494018c92698096c7d96e5a68e1e130265f42d154f,['outrem'],guarda,seia,união das freguesias de torrozelo e folhadosa,61-80,['moradia'],['T3'],2002,portugal,<7001,2,2,['estudante-tempo-integral'],licenciatura,['indiferente'],NR,NR,,,,,,"['financeiramente-dependente', 'quero-independecia']",2024-05-16 14:22:50.067,,,,,,,,,,,,,True,dd8e737ad3f0dbb036f32eb9b5899feb,
268,664653856e0392c9fa3ca105,e1f402eda8e6f135d6f21a73c4b2cc545db591da0af7b90ced44e94fee443440,['arrendo'],porto,matosinhos,união das freguesias de matosinhos e leça da palmeira,61-80,['apartamento'],['T1'],1994,brasil,20001-35000,0,1,['empregado-tempo-inteiro'],mestrado,['satisfeito'],"Estou a morar na habitação atual há 8 meses. Antes eu arrendava um pequeno studio por quase o mesmo preço. Num futuro pretendo ou voltar ao Brasil ou procurar um arrendamento mais longe de Porto e Lisboa. Os maiores desafios são ligados somente ao preço que me leva metade do salário. Durante o processo, mesmo eu tendo bom relacionamento com meu senhorio anterior e um ""bom salário"", eu quase não consegui arrendar por não acharem que o salário era suficiente, precisei pagar mais um arrendamento adiantado. ",NR,50,850.0,2024.0,20001-35000,['sem-ajuda'],['pago-demasiado'],2024-05-16 18:42:13.171,,,,,,,,,,,,,True,58e9ff26bcffad16bbafb56493fe5222,
269,6647297adceb8b44013c8c3c,f51f8adfbad9e356c3417a18998fbefcff5e09e031d66ad08eb458b38be27184,['outrem'],lisboa,lisboa,estrela,201-400,['apartamento'],['T4+'],1996,portugal,12001-20000,2,1,"['empregado-tempo-inteiro', 'estudante-tempo-integral']",mestrado,['indiferente'],NR,NR,,,,,,"['financeiramente-dependente', 'quero-independecia']",2024-05-17 09:55:06.089,,,,,,,,,,,,,True,a5a28ad0f7f9a4ef8cbd769e917b07cf,
270,66475a5e3736af1dc4aa4fba,43d0773e86f78efcc9bef97d771d67f58d0983c0f23cbf57513800847ae9eccb,['outrem'],coimbra,condeixa-a-nova,união das freguesias de sebal e belide,101-200,['moradia'],['T4+'],1985,portugal,7001-12000,3,0,['desempregada'],doutoramento,['indiferente'],NR,NR,,,,,,['quero-independecia'],2024-05-17 13:23:42.472,,,,,,,,,,,,,True,a591934ce74ff5d2ceafcfaabe919f3b,
271,6648c693802878b19ef7916b,fe250b498832169afc4ed51cfb8438d491439ae721abfd884de84212a10994fe,['comprei'],setúbal,setúbal,setúbal (são sebastião),201-400,['moradia'],['T4+'],1950,suica,>80001,1,0,['aposentado'],mestrado,['satisfeito'],"Sem maiores problemas, compra através de imobiliária, boas condições do banco.",NR,,,,,,['outro'],2024-05-18 15:17:39.233,265000.0,2019.0,bom,['emprestimo'],>80001,1. Muitos cachorros latindo de manhã cedo 2. Às vezes cheiro forte da indústria na zona leste da cidade,,,,,,,True,576765d1de1cf05ad4d3fa5a2177c525,
272,6648fee8ea21f299ef6b81b4,63e5a609c620a4ca71bf9a77045a59c8ea2b89c3319f49b7e7087e5e9fcd103b,['arrendo'],viseu,viseu,viseu,101-200,['apartamento'],['T3'],1954,estados_unidos,12001-20000,0,0,['independente'],ensino-profissional,['insatisfeito'],NR,NR,100,700.0,2022.0,12001-20000,['sem-ajuda'],['outro'],2024-05-18 19:18:00.346,,,,,,Extremely noisy neighbors and barking dogs,,,,,,,True,572938c74c861f4bb376593c631fa37f,
273,6649e619b134a6fda6957a3a,06e3b644c8eba2fccffce498b65a381d4a5fb7b96051f22e6a8be5a25905edc5,['comprei'],braga,vila nova de famalicão,ribeirão,81-100,['apartamento'],['T2'],1993,portugal,20001-35000,0,0,['empregado-tempo-inteiro'],mestrado,['muito-satisfeito'],NR,NR,,,,,,,2024-05-19 11:44:25.909,190000.0,2022.0,recem-construido,['emprestimo'],35001-50000,,,,,,,,True,f27899e0a5c6db80d1d51c1f2ca77b11,
274,6649f9ce8f045a5c5bd43e65,17d5a94771486a3f4b87e5881868f26a3bf6eb6fd4e0f896eb2c5d762182aae9,['comprei'],lisboa,odivelas,união das freguesias de póvoa de santo adrião e olival basto,81-100,['apartamento'],['T3'],1979,portugal,12001-20000,0,2,['empregado-tempo-inteiro'],secundario,['muito-satisfeito'],NR,NR,,,,,,,2024-05-19 13:08:30.365,100000.0,2006.0,raiz,['sem-ajuda'],12001-20000,,,,,,,,True,84f24c749f20add01b2e37e074dee788,
275,664a10e5d663c1a104254fe0,1555cab9567b59bbf4ed4a049e374443f48cef2d71712f996c59a6a635077960,['herdei'],porto,póvoa de varzim,"união das freguesias de aver-o-mar, amorim e terroso",101-200,['apartamento'],['T3'],1992,portugal,20001-35000,0,0,['empregado-tempo-inteiro'],secundario,['muito-satisfeito'],NR,NR,,,,,,,2024-05-19 14:47:01.309,,,,,,,,,2018.0,7001-12000,NA,raiz,True,dac6bf279ed9fdfb2d064eb52b550aa1,
276,664a38c946c02fd050dacf82,ff5cd572c19aaae5d1d582be85649373d1c253600a4e712cc69ef1ada46d94f8,['arrendo'],porto,matosinhos,união das freguesias de são mamede de infesta e senhora da hora,21-40,['apartamento'],['T1'],1994,portugal,20001-35000,1,0,['empregado-tempo-inteiro'],mestrado,['satisfeito'],NR,NR,50,450.0,2022.0,12001-20000,['sem-ajuda'],['falta-espaco'],2024-05-19 17:37:13.518,,,,,,,,,,,,,True,1b979f4009d0782b34690442c17a7062,
277,664a53eb6d7d01997f67b851,e146d71d10d9934d1cffcc96b73bcc23e84ccffb641b8d3233bbfb3693042c59,['comprei'],porto,maia,águas santas,201-400,['moradia'],['T4+'],1964,portugal,20001-35000,3,3,['empregado-tempo-inteiro'],licenciatura,['indiferente'],NR,. ,,,,,,['pago-demasiado'],2024-05-19 19:32:59.186,250.0,2005.0,raiz,['emprestimo'],20001-35000,,,,,,,,True,db5f56feec1fa7d97be232763235d811,
278,664b0c7e53b34e5202ac404b,5b84b9c1cfe1f505967a757d06f8bec90cab2f42f35ef6ab5ad4c049447f0574,['comprei'],setúbal,seixal,amora,81-100,['apartamento'],['T3'],1983,brasil,20001-35000,0,3,['empregado-tempo-inteiro'],estudo-superior,['satisfeito'],NR,NR,,,,,,['outro'],2024-05-20 08:40:30.631,136500.0,2020.0,execelente,['emprestimo'],20001-35000,vizinhos e condições do prédio,,,,,,,True,0a2660b4fe65538c85e557d6c0a16fb4,
279,664b1fe0c2f120a3ddceb1a2,3c5a8b086ad4aa64c837f9390be071a9b2d5c031968739bc090d0fd36028c960,['arrendo'],setúbal,seixal,amora,41-60,['apartamento'],['T2'],1987,brasil,7001-12000,2,2,"['independente', 'estudante-tempo-parcial']",secundario,['insatisfeito'],"Vivia num bom quarto até que uma das pessoas começou a fazer asneiras. Tive que me abrigar na casa do meu irmão. Depois fui para um t0 em péssimas condições e o senhorio se recusava a fazer melhorias. Por fim, fui para um quarto.  As pessoas são boas,  mas eu não tenho espaço pra quase nada. Tive que me desfazer de muita coisa. Para além disso, vive na casa uma criança hiperativa e que a mãe se recusa a tratar. Então éramos eu, essa criança e a mãe dele. Agora veio a avó morar junto. É um t2 transformado em t3. O meu quarto é o menor de todos. Pago 375€ de 650€. A casa só possui uma casa de banho. Não consigo lavar a minha roupa na casa. É uma situação complicada. ",Só espero que me ajudem. E obrigada desde já por essa iniciativa tão louvável. ,55,375.0,2023.0,7001-12000,['apoio-familiar-inicio'],"['falta-espaco', 'pago-demasiado', 'quero-independecia']",2024-05-20 10:03:12.052,,,,,,,,,,,,,True,58a01452cbb02747bb9837a393d6cb39,
280,664b2049c2f120a3ddceb1a4,7a4a5dd882483a873d9c6c20af619a8c2a8a1f60debd30b74800d5a1033a3b67,['outrem'],lisboa,lisboa,são domingos de benfica,61-80,['apartamento'],['T2'],1994,portugal,12001-20000,1,0,['empregado-tempo-inteiro'],mestrado,['muito-satisfeito'],NR,NR,,,,,,,2024-05-20 10:04:57.271,,,,,,,,,,,,,True,145e22338edc1e093fae0ce27383f229,
281,664b20f3c2f120a3ddceb1a6,ea08cc5c03968652decebf9baf04acc8e2eaab14cd539900c97a14e9329b2484,['arrendo'],lisboa,lisboa,são domingos de benfica,61-80,['apartamento'],['T2'],1993,portugal,20001-35000,0,0,['empregado-tempo-inteiro'],mestrado,['satisfeito'],NR,NR,100,950.0,2023.0,20001-35000,['sem-ajuda'],['pago-demasiado'],2024-05-20 10:07:47.771,,,,,,,,,,,,,True,7c70b4a539a7d4f6e07e300e2cc3849c,
282,664b232ac816d3173383815b,3b89afde93836ce9f4514140219cf676694c6e69cff4cce90b3f6ae0a771a9d5,['comprei'],leiria,leiria,"união das freguesias de leiria, pousos, barreira e cortes",101-200,['apartamento'],['T3'],1994,portugal,20001-35000,1,0,['empregado-tempo-inteiro'],licenciatura,['muito-satisfeito'],,NR,,,,,,,2024-05-20 10:17:14.629,210000.0,2024.0,bom,"['emprestimo', 'conjunto', 'apoio-familiar', 'sem-ajuda']",20001-35000,,35001-50000,,,,,,True,9671f751ca8bb5aac7ac6821e4393ae7,
283,664b23cbc816d3173383815d,1c9f4089f0bc0a852737253dd835fa0641d3f8ad9651a0cfce82a9bdd43c58d6,['arrendo'],porto,póvoa de varzim,"união das freguesias de aver-o-mar, amorim e terroso",41-60,['apartamento'],['T1'],1995,portugal,12001-20000,1,0,"['outro', 'estudante-tempo-integral', 'contrato-temporario']",mestrado,['satisfeito'],,NR,50,125.0,2024.0,12001-20000,['outra'],['falta-espaco'],2024-05-20 10:19:55.233,,,,,,,,"Apartamento que pertence a uma amiga de família, que alugou a um valor acessível",,,,,True,434e6fe5259dcc69701037e61a102baa,
284,664b3db26e5226cbe16c8074,c914d7c3eb6da0b44eeee928aa65232dd7859347c2cbd8811f783d866ad7bef1,['arrendo'],setúbal,seixal,amora,21-40,['apartamento'],['T2'],1997,botsuana,12001-20000,2,1,['empregado-tempo-inteiro'],secundario,['satisfeito'],NR,NR,100,635.0,2022.0,12001-20000,['sem-ajuda'],['pago-demasiado'],2024-05-20 12:10:26.758,,,,,,,,,,,,,True,3dc90318eee3a30f7ea19107b047ab7f,
285,664b49309419f678c1d3f2e9,9d289e0064a0dcb26be93bd921d8585e9b75ee069c0581ee71e1d0953f66604c,['comprei'],porto,matosinhos,união das freguesias de são mamede de infesta e senhora da hora,61-80,['apartamento'],['T2'],1990,portugal,35001-50000,0,0,['empregado-tempo-inteiro'],mestrado,['muito-satisfeito'],"Estive 6 anos a viver com o meu ex namorado num T2 com uma renda de 525-570€, sem recibos apesar de haver um ""contrato"". Quando me separei o senhorio decidiu mudar o contrato e aumentou a renda para os 1000€ o que foi incomportavel. Mudei para um t1 onde estive 6 meses a pagar 650euros de renda e depois encontrei este imovel que comprei onde basicamente estou a pagar um valor ao banco semelhante a renda que pagava antes",NR,,,,,,,2024-05-20 12:59:28.854,175000.0,2024.0,bom,['emprestimo'],35001-50000,,,,,,,,True,ceef94f368254a50e9be0bac2619922f,
286,664b5aeb6010c2f5a799a7dc,52619def7b358c4ec379b61ae97fb25bc882ecdcf700c501a1cd34f1bb5d636e,['herdei'],lisboa,loures,união das freguesias de santo antónio dos cavaleiros e frielas,201-400,['moradia'],['T4+'],1967,portugal,12001-20000,5,0,['empregado-tempo-inteiro'],secundario,['muito-satisfeito'],"Estou muito satisfeito com a minha habitação, realizei remodelação recente e não pretendo mudar no futuro imediato.",NR,,,,,,,2024-05-20 14:15:07.086,,,,,,,,,2000.0,35001-50000,>80001,raiz,True,431eff4d82038d7b434b4c7469931d5a,
287,664b5c476010c2f5a799a7de,6e00ae7408ba6b4d0032aeef5f89c18ad069bfad1cb9b985030bf8b3ee73e8f7,['comprei'],porto,santo tirso,"união das freguesias de santo tirso, couto (santa cristina e são miguel) e burgães",81-100,['apartamento'],['T2'],1993,portugal,20001-35000,1,0,['empregado-tempo-inteiro'],mestrado,['satisfeito'],NR,NR,,,,,,['outro'],2024-05-20 14:20:55.110,125000.0,2021.0,bom,['emprestimo'],20001-35000,NR,,,,,,,True,3d5176bb0b067518b18b4cc83abf8955,
288,664c5c3ab9a56ff9d6b837ba,d15a846803e9128cb9d8b787494eeccfa8689e3314f03c4e5c34dc05cae726f3,['arrendo'],lisboa,oeiras,"união das freguesias de oeiras e são julião da barra, paço de arcos e caxias",<20,['apartamento'],['T0'],2001,brasil,12001-20000,0,0,['empregado-tempo-inteiro'],mestrado,['insatisfeito'],Muita burocracia,NR,100,689.0,2023.0,12001-20000,['sem-ajuda'],['pago-demasiado'],2024-05-21 08:32:58.976,,,,,,,,,,,,,True,b217fc24c79428ac9605f890157c157c,
289,664c6a2a765190af427bd5eb,cfdaaf7528caf3d4f6d6c7efc3d52b1db9452a6dca7935ffc539553586fbc486,['comprei'],porto,trofa,união das freguesias de bougado (são martinho e santiago),101-200,['apartamento'],['T3'],1991,portugal,20001-35000,0,0,['empregado-tempo-inteiro'],mestrado,['muito-insatisfeito'],"Tenho 32 anos, comprei a minha 1ª casa sozinha, não tive ajudas nenhumas do estado, impostos muitos altos, sem isenção do IMI. Pelo menos isenção do IMI deveria ter e os impostos com a compra da casa são demasiado altos. Tive de dar entrada de 10%, para os jovens hoje em dia é impossivel. ",NR,,,,,,['pago-demasiado'],2024-05-21 09:32:26.783,200000.0,2023.0,bom,['emprestimo'],20001-35000,,,,,,,,True,80cb5a1025fae77e727b6072d9180a27,
290,664ca6e764a133084e2e3447,da4dee4d54c5ff74416d8a5f4e71e3bd0260fced3e6a56e852a15c3edd3f437d,['herdei'],setúbal,almada,costa da caparica,41-60,['apartamento'],['T2'],1989,portugal,<7001,1,0,['desempregada'],secundario,['insatisfeito'],NR,NR,,,,,,"['habitacao-mau-estado', 'vivo-longe-de-transportes', 'vivo-longe', 'dificuldades-financeiras']",2024-05-21 13:51:35.242,,,,,,,,,2024.0,<7001,<7001,medio,True,346a857aca3edea1c0516be06a7e8a92,
