,_id,email,situacao-habitacional,distrito,concelho,freguesia,area-util,tipo-casa,tipologia,ano-nascimento,nacionalidade,rendimento-anual,num-pessoas-nao-dependentes,num-pessoas-dependentes,situacao-profissional,educacao,satisfacao,testemunho,comentarios,percentagem-renda-paga,valor-mensal-renda,ano-inicio-arrendamento,rendimento-arrendamento,estrategia-arrendamento,insatisfacao-motivos,insertedAt,valor-compra,ano-compra,estado-conservacao,estrategia-compra,rendimento-liquido-anual-individual-na-compra,outra-insatisfacao,rendimento-liquido-anual-conjunto-na-compra,outra-estrategia-arrendamento,ano-heranca-aquisicao,rendimento-liquido-anual-individual-na-aquisicao,rendimento-heranca-conjunto,estado-conservacao-heranca,hashingV2,salt,outra-estrategia-compra
142,66421bc148339544955e6f08,a79cd395b42b97cfeab17343062e312f0404e332b77797eadf434e7ae6359b4d,['comprei'],porto,valongo,ermesinde,101-200,['apartamento'],['T3'],1997,portugal,20001-35000,1,0,"['empregado-tempo-parcial', 'estudante-tempo-parcial', 'outro']",doutoramento,['satisfeito'],NR,NR,,,,,,['outro'],2024-05-13 13:55:13.420,218000.0,2022.0,raiz,"['emprestimo', 'conjunto']",12001-20000,NR,20001-35000,,,,,,True,b12e6a73754b5d838627f7a3dd998116,
143,66421d6f48339544955e6f0a,8f036543284e9ccd5bceb9232cc1583214037d0d9f2911865d5222381f8ab099,['comprei'],lisboa,lisboa,avenidas novas,81-100,['apartamento'],['T4+'],1974,portugal,7001-12000,1,3,['independente'],mestrado,['satisfeito'],NR,NR,,,,,,['habitacao-mau-estado'],2024-05-13 14:02:23.423,257000.0,2004.0,bom,['emprestimo'],35001-50000,,,,,,,,True,2cd25560569c9892d652f8cf4b97e079,
144,66421f3548339544955e6f0c,c37f49d07d4fc5bd473ddb253f881e555fac16ea2670ab5034bb754523cadda8,['comprei'],aveiro,aveiro,união das freguesias de glória e vera cruz,81-100,['apartamento'],['T3'],1993,portugal,50001-80000,1,0,['independente'],licenciatura,['satisfeito'],NR,NR,,,,,,['pago-demasiado'],2024-05-13 14:09:57.227,210000.0,2023.0,medio,['emprestimo'],35001-50000,,,,,,,,True,e73d6420c29d377c2b072b567a1b35aa,
145,66422a6f6a0244e07546d53f,a3900c5540f7cb01d983ca7f65c38c5377b4d14f7b1820a1b0c748d63830a6c6,['arrendo'],braga,vila nova de famalicão,união das freguesias de vila nova de famalicão e calendário,81-100,['apartamento'],['T2'],1995,portugal,35001-50000,1,0,['empregado-tempo-inteiro'],mestrado,['muito-satisfeito'],NR,NR,65,445.0,2024.0,35001-50000,['sem-ajuda'],,2024-05-13 14:57:51.479,,,,,,,,,,,,,True,0e6a24da01e7b564d5df71b439da1de7,
146,664233487e88725a4c4cdc98,f03c1470a86ad789f04c7a02c9a2cdbd406c19717326e6bb366eb7422616fb9b,['arrendo'],porto,porto,paranhos,81-100,['apartamento'],['T1'],1996,portugal,20001-35000,1,0,['empregado-tempo-inteiro'],mestrado,['satisfeito'],NR,NR,50,350.0,2023.0,20001-35000,['sem-ajuda'],['pago-demasiado'],2024-05-13 15:35:36.048,,,,,,,,,,,,,True,1243968a0ef3b758714a067f882379b6,
147,66423eefdfa2be2bb2fcca14,a9b1469dfac4ecc4459ff0168d1e3821e568e0eacfbab3a253ea346858820b43,['outrem'],braga,barcelos,macieira de rates,61-80,['apartamento'],['T2'],1992,portugal,35001-50000,1,0,['empregado-tempo-inteiro'],estudo-superior,['insatisfeito'],"Vivo no mesmo apartamento há mais de 5 anos, arrendado ""ilegalmente"" por uma amiga. Por não ser declarado, pago um renda mais acessível. Mas quero muito comprar casa, porque a qualquer momento posso ser convidada a sair. Isso dá-me muita ansiedade.",,,,,,,"['falta-espaco', 'vivo-longe-de-transportes']",2024-05-13 16:25:18.946,,,,,,,,,,,,,True,0d2045f3b0111be92db22d2120d6f016,
148,664245e8bf4f87c395428808,3624af093e0291777f80b7deefafd4ef8dff9b5719e6f94796c9482570c11368,['arrendo'],porto,matosinhos,união das freguesias de são mamede de infesta e senhora da hora,21-40,['apartamento'],['T1'],1995,portugal,12001-20000,0,0,['estudante-tempo-parcial'],doutoramento,['satisfeito'],NR,NR,100,420.0,2017.0,12001-20000,['apoio-familiar-actualmente'],"['financeiramente-dependente', 'dificuldades-financeiras']",2024-05-13 16:55:04.241,,,,,,,,,,,,,True,db6d0aedec9be3e8f601f1aa548f4478,
149,66424911a832fee19fbf56b4,8dca6c6bf22388d375edd812f192db89bb78ea6189f0295ca81146ccd7d9a44b,['outrem'],porto,gondomar,rio tinto,81-100,['apartamento'],['T3'],1988,portugal,12001-20000,2,0,['empregado-tempo-inteiro'],mestrado,['insatisfeito'],NR,NR,,,,,,['quero-independecia'],2024-05-13 17:08:33.155,,,,,,,,,,,,,True,8842c88007aa3679b2e9fa787bf2d9f1,
150,664249bea832fee19fbf56b6,df9d7b4cfeae8a588905561c47bab2eaee2be3342cfb9c632aa58826195d2330,['comprei'],braga,vila nova de famalicão,união das freguesias de antas e abade de vermoim,101-200,['apartamento'],['T3'],1995,portugal,20001-35000,2,0,['empregado-tempo-inteiro'],mestrado,['insatisfeito'],NR,NR,,,,,,"['dificuldades-financeiras', 'pago-demasiado']",2024-05-13 17:11:26.955,258500.0,2022.0,raiz,"['apoio-familiar', 'emprestimo']",20001-35000,,,,,,,,True,d24c3a2cb8e871b1cb51957adf37125e,
151,664252c74b68afe9c3c6e24f,b971f7fa3e0600357d00ccf8b26290e80c2e3ac1ebcb051dcb2c01b451e3e829,['arrendo'],lisboa,lisboa,arroios,61-80,['apartamento'],['T2'],1997,portugal,50001-80000,1,0,['empregado-tempo-inteiro'],mestrado,['muito-satisfeito'],"A maior frustração é que, mesmo com um salário elevado, comprar uma casa em Lisboa para habitar confortavelmente uma família não é fácil, principalmente devido à limitação da carga de esforço nos empréstimos bancários",NR,50,450.0,2022.0,20001-35000,['sem-ajuda'],,2024-05-13 17:49:59.183,,,,,,,,,,,,,True,36f53733188f546828e265985ec7e51d,
152,664255c3bf2533359c7a11c4,ec9299d3693821d7efdb2086b6a4cdeb2d9c5dea7192fa74743876ef03b57f9e,['comprei'],porto,santo tirso,"união das freguesias de santo tirso, couto (santa cristina e são miguel) e burgães",101-200,['moradia'],['T3'],1994,portugal,20001-35000,1,0,['empregado-tempo-inteiro'],mestrado,['muito-satisfeito'],,NR,,,,,,,2024-05-13 18:02:43.587,300000.0,2023.0,execelente,"['emprestimo', 'conjunto']",20001-35000,,35001-50000,,,,,,True,3498804d86e82dee895c3b7f161dce85,
153,66425644bf2533359c7a11c6,e810a31db85b377c996f1df55af7997a31df226cd77a918df214728fb058958a,['outrem'],porto,valongo,alfena,81-100,['apartamento'],['T3'],1974,portugal,7001-12000,2,2,['desempregada'],doutoramento,['muito-insatisfeito'],NR,NR,,,,,,['quero-independecia'],2024-05-13 18:04:52.409,,,,,,,,,,,,,True,754d40184078685c628184ee2d92fe57,
154,66425892bf2533359c7a11c8,cba2d554e0cb89a3a7864987822426b7aa3608b66d44b331baf7f88a44fdd097,['outrem'],porto,vila do conde,vila do conde,101-200,['apartamento'],['T3'],1995,portugal,12001-20000,2,0,['empregado-tempo-inteiro'],licenciatura,['insatisfeito'],NR,NR,,,,,,['quero-independecia'],2024-05-13 18:14:42.660,,,,,,,,,,,,,True,27a4604936dec4a2a8e5badb377e3570,
155,66425e249d26075f12d1fbd7,7b84cd5e86e66d9931a6dce77e3eb9abfe5edd4bedcd0e0e80614329e150c269,['outrem'],porto,póvoa de varzim,"união das freguesias da póvoa de varzim, beiriz e argivai",101-200,['apartamento'],['T3'],1995,portugal,20001-35000,1,0,['empregado-tempo-inteiro'],licenciatura,['satisfeito'],Ter uma casa própria.,NR,,,,,,['financeiramente-dependente'],2024-05-13 18:38:28.994,,,,,,,,,,,,,True,e4c92e17535d6bc7afdf1ed712ed4614,
156,66425eea9d26075f12d1fbd9,f17b11809b509459cb73c5e95ccf64c9d11ec3c77bb391c8179e89bb7db0ec2f,['outrem'],braga,braga,sequeira,201-400,['moradia'],['T4+'],1991,portugal,35001-50000,2,0,['empregado-tempo-inteiro'],licenciatura,['satisfeito'],NR,NR,,,,,,['quero-independecia'],2024-05-13 18:41:46.414,,,,,,,,,,,,,True,58590d2039e5fd86e3e3a804be399778,
157,66426424165275874e94955e,6954636709f89cf785bdbe57f3e1608814cb344dc166e3cbd87948961d81af48,['comprei'],porto,maia,vila nova da telha,101-200,['apartamento'],['T2'],1993,portugal,20001-35000,1,0,['empregado-tempo-inteiro'],mestrado,['muito-satisfeito'],NR,NR,,,,,,,2024-05-13 19:04:04.397,186000.0,2022.0,execelente,['emprestimo'],20001-35000,,,,,,,,True,d50d95c2d6e7db0a00606961cf4c6764,
158,664266b9165275874e949560,1c4aa9dfe06a298e5545bad44e6caccdf6937a304cfe0c6c92632d9a790048bb,['herdei'],porto,porto,"união das freguesias de aldoar, foz do douro e nevogilde",101-200,['moradia'],['T3'],1984,portugal,20001-35000,1,0,['empregado-tempo-inteiro'],doutoramento,['insatisfeito'],NR,NR,,,,,,"['habitacao-mau-estado', 'outro']",2024-05-13 19:15:05.918,,,,,,NR,,,2015.0,20001-35000,20001-35000,medio,True,be8ffe4469cc6ba6c3db8aa32802639e,
159,664267b6165275874e949562,434c4edfc9014458cfa166818a52013b18bf34763464f246c36de9589cf0de03,['comprei'],lisboa,lisboa,marvila,61-80,['apartamento'],['T2'],1995,portugal,20001-35000,0,0,['empregado-tempo-inteiro'],licenciatura,['satisfeito'],NR,NR,,,,,,['pago-demasiado'],2024-05-13 19:19:18.337,256000.0,2021.0,bom,"['emprestimo', 'conjunto']",12001-20000,,35001-50000,,,,,,True,d0fb70a232db91fa24e5695f4efe542c,
160,6642690206b1f885384a8af9,950ccef9f5b9757371355d7503aa60e09d3d212edb0cdddede4b463e2335978c,['comprei'],leiria,alcobaça,benedita,101-200,['apartamento'],['T3'],1994,portugal,12001-20000,0,0,['independente'],mestrado,['muito-satisfeito'],"- estou na nossa casa desde Dez. ano passado, antes alugávamos casa em Lisboa
não pretendo mudar de casa tão cedo
- a dificuldade a lidar com o banco, muito pouco interessados em ajudar","agradeço este tipo de inquéritos, e vou partilhar com amigos",,,,,,,2024-05-13 19:24:50.035,165000.0,2023.0,bom,"['emprestimo', 'conjunto']",12001-20000,,20001-35000,,,,,,True,b81026cd988e1d1c9b00e0d18af35e36,
161,664269b40306bceb0c6da85a,1a9b67fa31d2d7e550a4ecffc8c820dbcf8d260a07570a9b1c0bea73bf49dcb5,['outrem'],aveiro,mealhada,barcouço,201-400,['moradia'],['T3'],2002,portugal,<7001,2,2,['estudante-tempo-integral'],licenciatura,['insatisfeito'],NR,NR,,,,,,"['financeiramente-dependente', 'vivo-longe-de-transportes', 'quero-independecia', 'outro']",2024-05-13 19:27:48.173,,,,,,Vivo com os pais,,,,,,,True,b28caa0bb0ab4767efc83ebdd4c46c91,
162,66426b5d0306bceb0c6da85c,52d8e5fd8261941741725748026de78a5a186c7e274b411cf82ef718f0ca5c38,['arrendo'],braga,vila nova de famalicão,união das freguesias de vila nova de famalicão e calendário,61-80,['apartamento'],['T1'],1995,portugal,20001-35000,1,0,['empregado-tempo-inteiro'],mestrado,['satisfeito'],Quero comprar casa e não consigo juntar dinheiro para a entrada nem pagar a prestação ,NR,50,190.0,2020.0,7001-12000,['apoio-social'],['habitacao-mau-estado'],2024-05-13 19:34:53.197,,,,,,,,,,,,,True,c7a5cfd382fdd92ee9dc77ab8bd758fe,
163,66426d17ea0f260651709321,afe91975132da091920305a0aa20511f8bbf17e48592e631fa3ea64b5a98be98,['arrendo'],braga,braga,gualtar,41-60,['apartamento'],['T1'],1986,portugal,35001-50000,1,0,['empregado-tempo-inteiro'],mestrado,['muito-insatisfeito'],"Tenho rendimentos acima da média, gostava de comprar uma cada para constituir família e não consigo. ","Era interessante perceber além da situação atual, o que as pessoas procuram a curto prazo. Por exemplo na minha situação em que estou ativamente à procura de comprar casa. Esta situação não é representada. ",100,450.0,2017.0,12001-20000,['sem-ajuda'],"['vivo-longe', 'falta-espaco', 'pago-demasiado']",2024-05-13 19:42:15.217,,,,,,,,,,,,,True,6b394d1b386e4eb13308a7ffa50c9178,
164,66426fac15c4fbccbfa0e5ee,52ebf45c3fe512e49fc379b8c64bfa8cf5aa194789ed8b9f448bcdfcb4a2d27c,['outrem'],lisboa,vila franca de xira,vialonga,21-40,['apartamento'],['T1'],1987,portugal,12001-20000,2,1,['empregado-tempo-inteiro'],estudo-superior,['muito-insatisfeito'],Tinha uma casa alugada mas devido a especulação imobiliários a senhoria não quis renovar após 6anos.actualmente estou num casa de um família a tentar juntar dinheiro para entrada de uma casa.objectivo comprar casa a preços acessível controlado ,Portugal precisa de controlar os preços de um dos bens essenciais...casa quer para alugar quer para comprar para os portugueses.,,,,,,['outro'],2024-05-13 19:53:16.765,,,,,,Mais que junte dinheiro para comprar casa está sempre distante.preco das casas está impossível carissimo,,,,,,,True,615f03f11dd063c3e2f8bdeda28ca3ea,
165,6642720032574587d4d0b649,05713800f493aa76969531a5da770c15fff0a43b3541207258bf0f172b5c5764,['outrem'],porto,santo tirso,união das freguesias de lamelas e guimarei,41-60,['moradia'],['T3'],1994,portugal,12001-20000,3,1,['empregado-tempo-inteiro'],estudo-superior,['indiferente'],NR,NR,,,,,,['quero-independecia'],2024-05-13 20:03:12.963,,,,,,,,,,,,,True,2559b473aa7f248c80f8ec91b82747f2,
166,6642782f7a6db09970fa1353,6fb8950e71213f1f746758adb44575fe417174c33a98f077fbc65cc8205c2a6c,['comprei'],lisboa,cascais,união das freguesias de cascais e estoril,101-200,['apartamento'],['T3'],1970,portugal,12001-20000,1,2,['empregado-tempo-inteiro'],estudo-superior,['muito-insatisfeito'],"Pretendo mudar de zona, não porque não consiga pagar a hipoteca mas porque o custo do dia a dia é incomportavel; ","no eu concelho responsabilizo principalmente a crise na habitação pelo facto de que toda a reabilitação/construção feita na zona, foi sempre apontada para um segmento economico das elites. Compra-se ruina e vende-se nua fortuna....
Não parece ter havido qualquer investimento na habitação mais acessivel aos rendimentos médios ou mais baixos... ",,,,,,['outro'],2024-05-13 20:29:35.593,140000.0,2010.0,medio,['emprestimo'],35001-50000,Vivo numa zona onde o custo de vida é inflacionado pela presença de estrangeiros e segmento da população portuguesa com maiores rendimentos,,,,,,,True,36465f0955cd6a79ea7409f7bd3afb7b,
167,6642790c7a6db09970fa1355,5646e32e467aeb165e5d1c6be64c5d949dbec9e05d1978d7a131fbaef29e3f46,['comprei'],porto,santo tirso,"união das freguesias de santo tirso, couto (santa cristina e são miguel) e burgães",101-200,['apartamento'],['T3'],1982,portugal,50001-80000,1,2,['empregado-tempo-inteiro'],licenciatura,['muito-satisfeito'],"Já moravamos na casa que comprámos; estávamos a pagar renda dedutível futuramente em caso de compra. O empreteiro foi à falência, o agente de execução nao foi correcto na forma como conduziu o processo e tivemos que tratar nós de todo o processo burocrático de licencas camararias,certificados energético, um sem fim de burocracias altamente dispendiosas que acrescem em muito o preco da habitação ",NR,,,,,,,2024-05-13 20:33:16.512,180000.0,2015.0,medio,['emprestimo'],35001-50000,,,,,,,,True,3680932f9b8ad2161b5d86965287db6c,
168,66427a95a9eaa945908be054,9b4692a8542a1b6d6e13cc060897fda75c04f2ea93b1a4b7b87c5acc8aee6cd8,['comprei'],porto,gondomar,"união das freguesias de gondomar (são cosme), valbom e jovim",201-400,['moradia'],['T4+'],1965,portugal,12001-20000,2,1,['desempregada'],mestrado,['muito-satisfeito'],NR,NR,,,,,,,2024-05-13 20:39:49.192,200000.0,2001.0,raiz,['emprestimo'],12001-20000,,,,,,,,True,e0916b75b317e133ffb8375186df7aea,
169,66427ae072a491880227dafd,fb753386ce632ac9d4a22427ffb07f351a62e89f7e5261a9663259d8b6781331,['outrem'],lisboa,vila franca de xira,vialonga,21-40,['apartamento'],['T1'],1978,portugal,12001-20000,1,0,['empregado-tempo-inteiro'],estudo-superior,['insatisfeito'],"Estou há 5 anos nesta casa.
Antes tive 6 anos em casa arrendada. A senhoria terminou contrato porque pretendeu posteriormente arrendar a casa com um valor mais elevado.
O objetivo é comprar casa.
O maior desafio é ver o valor das casas aumentar a um ritmo alucinante e não conseguir ter rendimentos para acompanhar as subidas. Faz lembrar ""um burro atrás de uma cenoura"".
Outra frustração é ver a idade a avançar. Causa ansiedade por se tornar mais difícil um empréstimo e não vislumbrar ajudas ou melhorias no estado em que o mercado habitacional caiu. 
Com os aumentos, é muito difícil ter o valor da entrada e também o valor diferencial para o empréstimo versus o valor da casa.
A especulação imobiliária tomou conta do mercado e dificulta cada vez mais quem tem menos.
Outra ansiedade é saber que nesta casa onde habito, sendo emprestada, sei que terei de sair quando a mesma for necessária para os donos ou seus descendentes, deixando-me numa situação sem casa, sendo que as possibilidades serão a muitos Km do local de trabalho, assim como da família, o que irá deteriorar o bem estar psicológico.
Mais escrevo, que esta situação fez atrasar a minha pretensão de formar família, ao que com a idade a avançar se torna cada vez mais difícil.","Acho que a minha história descrita no Ponto 20 é elucidativa do que se passa.
Mais digo que são preciso apoios para os jovens, mas não só, pois com 45 anos, estou numa posição também difícil ao que deveriam também olhar para essa faixa etária.
Acho que se deve combater a especulação de preços da habitação. Se para assim for inundar o mercado com casas do estado, que seja, mas quem está a perder são os que, como eu, trabalham e não conseguem (há anos) ter uma casa própria, o que significa que não temos segurança de um dia continuar com um teto.
Parece que vamos voltar aos antepassados e procurar uma gruta para viver tendo em conta o que vislumbra no nosso futuro próximo.",,,,,,['outro'],2024-05-13 20:41:04.539,,,,,,"Pretendia ter casa própria. Nesta casa, sendo emprestada, não me sinto em casa.",,,,,,,True,0c793dc8e6711ba92988ffec88e4d59d,
170,66427c1e72a491880227daff,29db7219502b38e08e0f87bde721f369668fcfb76b0ffd3082389143f7befe6a,['outrem'],leiria,alcobaça,benedita,61-80,['apartamento'],['T1'],1994,portugal,12001-20000,1,0,['empregado-tempo-inteiro'],mestrado,['insatisfeito'],"Estou nesta habitação à cerca de um ano por cedência de familiar, para no futuro tentar ter mais condições financeiras para construir uma habitação própria. ","Habitação, um abrigo com condições para um cidadão comum viver nos dias de hoje deve ser o mínimo que se pode oferecer à população, devem ser considerados mecanismos e estratégias económicas que procurem solucionar de vez o problema, principalmente para todos aqueles que não conseguem esse mínimo de condições. ",,,,,,['financeiramente-dependente'],2024-05-13 20:46:22.240,,,,,,,,,,,,,True,97b2428ab98afc9493613b355029b950,
171,66427eedd2eaca4ba0f090fb,986c50400d690853c13612a188320f81c08a505b3075e453999bff2e14600fc3,['comprei'],setúbal,almada,união das freguesias de caparica e trafaria,61-80,['apartamento'],['T3'],1949,portugal,20001-35000,0,1,['aposentado'],mestrado,['muito-satisfeito'],NR,Receber o resultado do questionário ,,,,,,,2024-05-13 20:58:21.047,125000.0,2019.0,execelente,['emprestimo'],35001-50000,,,,,,,,True,35d38eeb5f846abbe0696ca330d578c9,
172,664280d2d2eaca4ba0f090fd,84be31f6bc0e4d7ef5f0643313fd83b6be277e9d550ecca9e28767b37b0a3519,['herdei'],leiria,porto de mós,mira de aire,41-60,['moradia'],['T3'],1996,portugal,<7001,0,2,['licenca'],licenciatura,['indiferente'],"A casa é dos meus avós neste momento, tive de fazer grandes obras, mas a casa não está em meu nome mas fui eu que paguei. Ainda precisa de mais mas não tenho disponibilidade para tal. Mas felizmente tenho uma casa melhor do que tinha antes. Sonho sim em comprar casa mas e impossível. Para não falar que tenho de fazer grandes quilómetros para ter tudo perto! ",NR,,,,,,"['vivo-longe', 'dificuldades-financeiras']",2024-05-13 21:06:26.683,,,,,,,,,2024.0,<7001,<7001,mau,True,c1c97fdc87a88e267011c5318f931d19,
173,66428259d2eaca4ba0f090ff,86a72c904211e69944e398538ad7023f25fc5e898beb3569f2b4eff77097f53e,['arrendo'],leiria,caldas da rainha,santa catarina,21-40,['moradia'],['T1'],1998,portugal,12001-20000,1,0,['empregado-tempo-inteiro'],licenciatura,['satisfeito'],As principais dificuldades sentidas no nosso caso foram: As rendas estarem demasiado elevadas para o início de vida e o processo burocrático para iniciar a construção de uma casa ser demasiado longo. O que nos levou a ter de estar a pagar uma renda demasiado elevada (e a “perder” dinheiro) enquanto não conseguimos avançar com a construção da casa e arcar com um empréstimo com os juros que se praticam neste momento. ,NR,50,250.0,2023.0,12001-20000,['sem-ajuda'],['pago-demasiado'],2024-05-13 21:12:57.299,,,,,,,,,,,,,True,14f96c94dd6a24f470cda78fcb61c867,
174,664282a4d2eaca4ba0f09101,8c7941d1843601b3f2f9cdad44c8503e35c440e9b033f8aac8dd246fad8afec4,['herdei'],setúbal,almada,costa da caparica,201-400,['moradia'],['T4+'],1969,portugal,12001-20000,3,1,"['empregado-tempo-inteiro', 'independente']",licenciatura,['muito-satisfeito'],NR,NR,,,,,,,2024-05-13 21:14:12.419,,,,,,,,,2007.0,12001-20000,35001-50000,bom,True,40cc3058922a98f7432e485289b1088e,
175,66428403d2eaca4ba0f09103,31a5a643a04d5a8caa9fb6b626d74fa27641d656be748fe875c2b62bebc40280,['arrendo'],braga,esposende,antas,21-40,['moradia'],['T3'],1994,portugal,7001-12000,1,3,['empregado-tempo-inteiro'],ensino-profissional,['indiferente'],NR,NR,100,400.0,2023.0,7001-12000,['apoio-familiar-inicio'],"['pago-demasiado', 'habitacao-mau-estado']",2024-05-13 21:20:03.814,,,,,,,,,,,,,True,fc608aafd75a055f6f2ef06abca7b7ca,
176,6642847ed2eaca4ba0f09105,ca2b1429c0842913e4d2f6a21f7e3339f1e13490c020012e4d6ebbf79d9e5425,['comprei'],porto,porto,campanhã,101-200,['moradia'],['T2'],1993,portugal,35001-50000,1,1,"['empregado-tempo-inteiro', 'independente']",doutoramento,['satisfeito'],"2 anos
vivia num pequeno apartamento
impostos, prestação alta, reparações e obras
tudo foi facilitado pela imobiliária",NR,,,,,,['outro'],2024-05-13 21:22:06.914,250000.0,2022.0,medio,['emprestimo'],7001-12000,Cara e vendida com elementos ilegais,,,,,,,True,7f7de0e55aad3ef0c6c51a5ec3042a0d,
177,6642865dd2eaca4ba0f09107,db720a1fac88f26fb6400a79951576a2456de4973f33ded95082e0c3735b308c,['outrem'],lisboa,oeiras,"união das freguesias de oeiras e são julião da barra, paço de arcos e caxias",41-60,['apartamento'],['T3'],1991,portugal,12001-20000,1,0,['contrato-temporario'],mestrado,['muito-insatisfeito'],"Vivo desde sempre com a minha mãe, gostava (preciso) do meu espaço e de viver sozinha. Apesar de não receber mal, não tendo um companheiro para dividir as despesas, não é comportavel pagar 800€ de renda. Para comprar casa, os bancos não me emprestam pois sou professora contratada, sozinha, com o crédito do carro e sem muito dinheiro para dar de entrada",NR,,,,,,['quero-independecia'],2024-05-13 21:30:05.989,,,,,,,,,,,,,True,99851c1a7cc9120d5835e318728b3fd7,
178,664287f8d2eaca4ba0f09109,d848f2cb6d9b5f3a1221e5b87c27b0b8ee375f2bfc31e6b23999860465337467,['comprei'],lisboa,loures,loures,101-200,['moradia'],['T3'],1976,portugal,20001-35000,1,2,['empregado-tempo-inteiro'],secundario,['muito-satisfeito'],"Vivíamos numa casa muito pequena alugada. Depois de termos 30.000€ para um sinal, demoramos cerca de 18 meses até encontrarmos a casa pretendida. Maior desafio é fazer face ao valor do empréstimo à taxa atual, mais o seguro de vida do casal.",NR,,,,,,,2024-05-13 21:36:56.966,345000.0,2021.0,execelente,['emprestimo'],20001-35000,,,,,,,,True,09460366bb119e0ae9194df3aeb4c821,
179,66428a83523e20fc9ad97253,3703154573416d7bc3a9eb54d1aac3e1410a152b57fa38ae05f8702ede5f7256,['outrem'],leiria,alcobaça,benedita,81-100,['apartamento'],['T2'],1993,portugal,12001-20000,1,2,['licenca'],licenciatura,['satisfeito'],NR,NR,,,,,,['falta-espaco'],2024-05-13 21:47:47.072,,,,,,,,,,,,,True,74c1292f943470a0e1023da699e805a3,
180,66428bbe523e20fc9ad97255,0a5845edb5ec8335ce7cf1ed70b01d0421cde508ca6e4207fd5870de7498561a,['outrem'],leiria,caldas da rainha,santa catarina,81-100,['moradia'],['T3'],1993,portugal,12001-20000,1,2,['empregado-tempo-inteiro'],ensino-profissional,['insatisfeito'],NR,NR,,,,,,['quero-independecia'],2024-05-13 21:53:02.073,,,,,,,,,,,,,True,5feb3d22ccb7041158bc703e6592874a,
181,66428c0d523e20fc9ad97257,6ea0968ff1221855ac48980caeb09b9950e617a019796f0a92789e3bee1dac47,['arrendo'],porto,porto,ramalde,41-60,['apartamento'],['T1'],1995,portugal,20001-35000,0,0,['independente'],licenciatura,['insatisfeito'],"A opção entre transitar do arrendamento para habitação própria é incomportável, tudo é um problema: oferta, preço, localização, financiamento. A gravidade do problema é de tal ordem que atravessa todos os escalões de rendimento. ",NR,100,600.0,2018.0,7001-12000,['sem-ajuda'],['falta-espaco'],2024-05-13 21:54:21.613,,,,,,,,,,,,,True,3a9cfde505b43941ee589d937dd08098,
182,66428f0d77ee82298bf26982,2111c92e00a58f783f27f91e94eaf92ace0a2064ebf14954a0456ab04f54928f,['comprei'],lisboa,vila franca de xira,união das freguesias de alverca do ribatejo e sobralinho,101-200,['apartamento'],['T3'],1974,portugal,12001-20000,0,3,['empregado-tempo-inteiro'],licenciatura,['satisfeito'],"Resido na atual habitação à 16 anos, após 8 na anterior também residência própria adquirida com recurso a crédito hipotecário. Mudei de casa para ter melhores condições com o nascimento dos nossos filhos (2) com um intervalo de 2 anos, em 2007 e 2009. Mudámos de casa em maio de 2008. Mesmo a tempo de ter um spread bancário generoso, pois poucas semanas rebentou a crise do subprime nos EUA e a falência do BES em PT. Esse processo foi célere, tanto que num só dia outrgámos as escrituras de venda e a de compra das duas casas, coisa bem fora do comum, julgo. A concessão do crédito não teve obstáculos e mantivémo-nos na mesma instituição bancária.",As minhas preocupações vão para o futuro dos filhos e como conseguirão tornar-se independentes neste quadro tão complexo de dificuldades em ter acesso a uma habitação.,,,,,,"['vivo-longe', 'financeiramente-dependente', 'dificuldades-financeiras']",2024-05-13 22:07:09.771,165000.0,2008.0,bom,"['emprestimo', 'outra']",12001-20000,,,,,,,,True,c9d319ab848b8c2e52f6b35fe3fabed2,"Investi as mais valias da venda de casa, efetuada simultaneamente à aquisição da atual"
